"year","title","venue","category","modality","shift_or_focus","paper_url","code_url"
"2024","3D Open-Vocabulary Panoptic Segmentation with 2D-3D Vision-Language Distillation","ECCV","Open-world representation","RGB + point cloud + language","Open-vocabulary 3D panoptic segmentation","https://arxiv.org/search/?query=3D%20Open-Vocabulary%20Panoptic%20Segmentation%20with%202D-3D%20Vision-Language%20Distillation&searchtype=title",""
"2025","Hierarchical Cross-Modal Alignment for Open-Vocabulary 3D Object Detection","AAAI","Open-world representation","Point cloud + image + language","Open-vocabulary 3D detection","https://arxiv.org/search/?query=Hierarchical%20Cross-Modal%20Alignment%20for%20Open-Vocabulary%203D%20Object%20Detection&searchtype=title",""
"2021","ST3D: Self-Training for Unsupervised Domain Adaptation on 3D Object Detection","CVPR","Domain adaptation","LiDAR","Cross-dataset 3D detection","https://arxiv.org/search/?query=ST3D%20Self-Training%20for%20Unsupervised%20Domain%20Adaptation%20on%203D%20Object%20Detection&searchtype=title","https://github.com/CVMI-Lab/ST3D"
"2020","xMUDA: Cross-Modal Unsupervised Domain Adaptation for 3D Semantic Segmentation","CVPR","Domain adaptation","Camera + LiDAR","Cross-modal cross-domain segmentation","https://arxiv.org/search/?query=xMUDA%20Cross-Modal%20Unsupervised%20Domain%20Adaptation%20for%203D%20Semantic%20Segmentation&searchtype=title","https://github.com/valeoai/xmuda"
"2023","ResiMAD: Zero-Shot 3D Domain Transfer for Autonomous Driving with Source Reconstruction and Target Simulation","arXiv","Domain adaptation","LiDAR","Zero-shot cross-sensor and cross-domain transfer","https://arxiv.org/abs/2309.05527",""
"2024","BEVUDA++: Geometric-Aware Unsupervised Domain Adaptation for Multi-View 3D Object Detection","IEEE TCSVT","Domain adaptation","Multi-view camera","Cross-domain BEV geometry transfer","https://arxiv.org/search/?query=BEVUDA%2B%2B%20Geometric-Aware%20Unsupervised%20Domain%20Adaptation%20for%20Multi-View%203D%20Object%20Detection&searchtype=title",""
"2024","CADET: A Causal Disentanglement Approach for Robust Trajectory Prediction in Autonomous Driving","CVPR","Causal training","Trajectories + map","Robust prediction under contextual shifts","https://arxiv.org/search/?query=CADET%20A%20Causal%20Disentanglement%20Approach%20for%20Robust%20Trajectory%20Prediction&searchtype=title",""
"2021","Tent: Fully Test-Time Adaptation by Entropy Minimization","ICLR","Test-time adaptation","General vision","Source-free online entropy adaptation","https://arxiv.org/search/?query=Tent%20Fully%20Test-Time%20Adaptation%20by%20Entropy%20Minimization&searchtype=title","https://github.com/DequanWang/tent"
"2022","CoTTA: Continual Test-Time Domain Adaptation","CVPR","Test-time adaptation","General vision","Non-stationary continual shifts","https://arxiv.org/search/?query=CoTTA%20Continual%20Test-Time%20Domain%20Adaptation&searchtype=title","https://github.com/qinenergy/cotta"
"2022","EATA: Efficient Test-Time Model Adaptation without Forgetting","ICML","Test-time adaptation","General vision","Selective adaptation and anti-forgetting","https://arxiv.org/search/?query=EATA%20Efficient%20Test-Time%20Model%20Adaptation%20without%20Forgetting&searchtype=title","https://github.com/mr-eggplant/EATA"
"2023","SAR: Towards Stable Test-Time Adaptation in the Wild","ICLR","Test-time adaptation","General vision","Reliable samples and sharpness-aware adaptation","https://arxiv.org/search/?query=SAR%20Towards%20Stable%20Test-Time%20Adaptation%20in%20the%20Wild&searchtype=title","https://github.com/mr-eggplant/SAR"
"2023","SoTTA: Robust Test-Time Adaptation on Noisy Data Streams","NeurIPS","Test-time adaptation","General vision","Noisy streaming target data","https://arxiv.org/search/?query=SoTTA%20Robust%20Test-Time%20Adaptation%20on%20Noisy%20Data%20Streams&searchtype=title",""
"2023","EcoTTA: Memory-Efficient Continual Test-Time Adaptation via Self-Distilled Regularization","CVPR","Test-time adaptation","General vision","Memory-efficient continual adaptation","https://arxiv.org/search/?query=EcoTTA%20Memory-Efficient%20Continual%20Test-Time%20Adaptation&searchtype=title","https://github.com/mr-eggplant/ECoTTA"
"2023","RoTTA: Robust Test-Time Adaptation in Dynamic Environments","CVPR","Test-time adaptation","General vision","Dynamic imbalanced streams","https://arxiv.org/search/?query=RoTTA%20Robust%20Test-Time%20Adaptation%20in%20Dynamic%20Environments&searchtype=title","https://github.com/BIT-DA/RoTTA"
"2024","Entropy Is Not Enough for Test-Time Adaptation: From the Perspective of Disentangled Factors","NeurIPS","Test-time adaptation","General vision","DeYO sample selection under spurious correlation","https://arxiv.org/abs/2403.07366","https://github.com/Jhyun17/DeYO"
"2024","ViDA: Homeostatic Visual Domain Adapter for Continual Test-Time Adaptation","ICLR","Test-time adaptation","General vision","Continual shift with parameter-efficient adapters","https://proceedings.iclr.cc/paper_files/paper/2024/hash/d3e38662377dcce6203f4bb91b2a9b03-Abstract-Conference.html",""
"2020","Test-Time Training with Self-Supervision for Generalization under Distribution Shifts","ICML","Test-time adaptation","General vision","Auxiliary self-supervised online updates","https://arxiv.org/search/?query=Test-Time%20Training%20with%20Self-Supervision%20for%20Generalization%20under%20Distribution%20Shifts&searchtype=title",""
"2021","TTT++: When Does Self-Supervised Test-Time Training Fail or Thrive?","NeurIPS","Test-time adaptation","General vision","Feature alignment and TTT reliability","https://arxiv.org/search/?query=TTT%2B%2B%20When%20Does%20Self-Supervised%20Test-Time%20Training%20Fail%20or%20Thrive&searchtype=title",""
"2024","Bench2Drive: Towards Multi-Ability Benchmarking of Closed-Loop End-To-End Autonomous Driving","NeurIPS Datasets and Benchmarks","Safety evaluation","Multi-view camera + control","Closed-loop scenario and capability evaluation","https://proceedings.neurips.cc/paper_files/paper/2024/hash/017761f94a1cd66d01c041aff85492c4-Abstract-Datasets_and_Benchmarks_Track.html","https://github.com/Thinklab-SJTU/Bench2Drive"
